{"chapters": [{"id": "signs", "title": {"en": "Road signs and markings"}}], "examFormat": {"passMinCorrect": 22, "questionCount": 26, "timeLimitSec": 1800}, "meta": {"country": "xx", "languages": ["en"], "lawValidThrough": "2026-09", "packVersion": "0.1.0", "sources": ["https://example.invalid/road-code"]}, "questions": [{"article": "Vienna Convention, Annex 1", "chapter": "signs", "correct": ["b"], "difficulty": 1, "explanation": {"en": "Warning signs are triangular with red border."}, "id": "xx-signs-0001", "media": null, "options": {"en": {"a": "Round with red border", "b": "Triangular with red border", "c": "Square and blue"}}, "stem": {"en": "What shape does a danger-warning sign have?"}, "type": "single"}]}